{
  "$schema": "https://schema.evideris.com/schemas/competency.schema.json",
  "$id": "https://schema.evideris.com/esge/competency/emr-cln/smi-risk-stratification.v1.0.0.json",
  "lineageId": "c-emr-cln-smi-risk-stratification",
  "type": "competency",
  "version": "1.0.0",
  "release": "r2026.07",
  "supersedes": null,
  "supersededBy": null,
  "language": ["en"],

  "modality": "m-colonoscopy-emr",
  "kind": "theoretical",

  "title": { "en": "Submucosal invasion (SMI) risk stratification" },
  "description": {
    "en": "Application of the ESGE SMI risk algorithm to LNPCPs: integrates lesion location, morphology, surface/vascular pattern (NICE/JNET), and bulky features to decide between piecemeal EMR, en bloc resection, and surgical referral."
  },

  "milestones": [
    { "level": "novice",    "criteria": { "en": "Recognises bulky/rectal lesions as high-risk for covert SMI with prompting." } },
    { "level": "competent", "criteria": { "en": "Independently applies the SMI risk algorithm and chooses an appropriate resection strategy concordant with expert opinion ≥90 % of the time." }, "expectedAtCases": 30 },
    { "level": "expert",    "criteria": { "en": "Decisions match histology outcomes; teaches the algorithm; manages discordant cases via MDT." } }
  ],

  "qualityIndicatorRefs": [],
  "kpiRefs": [],

  "crossRefs": { "ukJag": [], "uemsCesma": [] }
}
