{
  "$schema": "https://schema.evideris.com/schemas/competency.schema.json",
  "$id": "https://schema.evideris.com/esge/competency/emr-cln/bleeding-management.v1.0.0.json",
  "lineageId": "c-emr-cln-bleeding-management",
  "type": "competency",
  "version": "1.0.0",
  "release": "r2026.07",
  "supersedes": null,
  "supersededBy": null,
  "language": ["en"],

  "modality": "m-colonoscopy-emr",
  "kind": "adverseEventManagement",

  "title": { "en": "Management of intra- and post-procedural EMR bleeding" },
  "description": {
    "en": "Recognition of significant intraprocedural bleeding, choice and safe deployment of haemostatic modalities (snare-tip soft coagulation, coagulation forceps, clips, thermal therapy), and management of clinically significant post-EMR bleeding."
  },

  "milestones": [
    { "level": "novice",    "criteria": { "en": "Recognises significant bleeding; selects a haemostatic modality with prompting." } },
    { "level": "competent", "criteria": { "en": "Independently controls intraprocedural bleeding; manages post-EMR bleeding without escalation in ≥90 % of cases." }, "expectedAtCases": 30 },
    { "level": "expert",    "criteria": { "en": "Teaches the technique; manages refractory bleeding; coordinates multidisciplinary response when required." } }
  ],

  "suggestedCaseload": 30,
  "qualityIndicatorRefs": [],
  "kpiRefs": [],
  "crossRefs": { "ukJag": [], "uemsCesma": [] }
}
