{
  "$schema": "https://schema.evideris.com/schemas/competency.schema.json",
  "$id": "https://schema.evideris.com/esge/competency/emr-cln/lesion-assessment.v1.0.0.json",
  "lineageId": "c-emr-cln-lesion-assessment",
  "type": "competency",
  "version": "1.0.0",
  "release": "r2026.07",
  "supersedes": null,
  "supersededBy": null,
  "language": ["en"],

  "modality": "m-colonoscopy-emr",
  "kind": "procedural",

  "title": { "en": "Endoscopic lesion assessment of LNPCPs" },
  "description": {
    "en": "Systematic assessment of large non-pedunculated colorectal polyps for size, morphology (Paris classification), site, access, surface and vascular pattern (NICE/JNET), and features predicting submucosal invasion."
  },

  "milestones": [
    { "level": "novice",    "criteria": { "en": "Identifies LNPCPs and applies Paris classification with prompting." } },
    { "level": "competent", "criteria": { "en": "Independently records SMSA, Paris morphology, NICE/JNET pattern, and flags features of SMI. Decision-aligned with senior reviewer ≥90 % of the time." }, "expectedAtCases": 30 },
    { "level": "expert",    "criteria": { "en": "Teaches lesion assessment; predicts histology pre-resection with high accuracy; recognises atypical lesions warranting alternative management." } }
  ],

  "suggestedCaseload": 30,

  "qualityIndicatorRefs": [],
  "kpiRefs": [],

  "crossRefs": { "ukJag": [], "uemsCesma": [] }
}
